{
  "id": "ctx_req_fetch_001",
  "sessionId": "sess_test_001",
  "deviceId": "android_test_device",
  "createdAt": "2026-04-16T07:10:00Z",
  "intent": "context_question",
  "userExplicitlyRequestedCodeAssertion": false,
  "screenshot": {
    "capturedAt": "2026-04-16T07:09:58Z",
    "mimeType": "image/png",
    "screenMetadata": {
      "appPackage": "dev.openbubble.demo",
      "visibleText": "Agent status"
    }
  },
  "prompt": {
    "capturedAt": "2026-04-16T07:09:59Z",
    "transcript": "What is the agent working on right now?",
    "language": "en-US"
  }
}
